username,comment,comment_likes,since_posted,current_date
@ephraimkhoza4378,this game was fast and furious we forgotten the transpoter,1,2 months ago,06/04/2024
@l.rhmarsiama5642,33:29 What a pass,1,2 months ago,06/04/2024
@NateWrig92,2 words. Instant Classic,1,2 months ago,06/04/2024
@user-vo7kn7pp7l,Great match. Only marred slightly by a jobsworth ref who could have easily turned a blind eye to raw emotion.,2,2 months ago,06/04/2024
@solo-yl8uc,is it hard to have a timer bro?,1,2 months ago,06/04/2024
@raymondbanjarnahor2105,the ref was clearly pro liverpool ..luckily MU survived.,1,6 days ago (edited),06/04/2024
@WLL-lk4qk,"Agree,  best sport in the world,  nothing comes close to it,  the intensity and dramatic result are fabulous.",,2 months ago (edited),06/04/2024
@dioterch.7407,Thanks,,2 months ago,06/04/2024
@arifkurnchannel7212,Antony underrated wingback,1,2 months ago,06/04/2024
@DragonEggFilms2023,What a game! Fantastic.,,2 months ago,06/04/2024
@bibahmawutor9959,Bonkers… the whole game ,,2 months ago,06/04/2024
@smyfik,Манчестер после этой игры просто обязан брать Кубок!!!,1,2 months ago,06/04/2024
@DeenM2099,As a neutral fan this match was fantastic! I can't remember the last time I watched a replay of a full game.,,2 months ago,06/04/2024
@arassi2710,Masterpiece one from Manchester United ,,2 months ago,06/04/2024
@MrWitho,Any danger of putting the clock on the screen?,1,2 months ago,06/04/2024
@mollynamuddu8588,"Congratulations to my team MANCHESTER UNITED 
️
️",,2 months ago,06/04/2024
@nitsuheshetu8968,For me maino and garnacho was The best player on the pitch,1,2 months ago,06/04/2024
@emmanueljohnny-moore2250,The way United played helped them to get back in the game the interchanging is so important in football nowadays that it is the best way to u balance teams and overload which we don’t do we have been so fixed to our positions it’s crazy at times you just want them to open the game up by running in different channels this game was all that!,,2 months ago,06/04/2024
@5eek3r0fknowl3dg3,This is a great soccer match both teams played very well,,1 month ago,06/04/2024
@edgerat,"Ten Hag's Toddlers maybe??? The ""kids"" are GETTING IT DONE for us!!!!",1,2 months ago,06/04/2024
@mokumoku6196,Never gets old Man U.. can rely on last minute comeback!,,2 months ago,06/04/2024
@clivethereddevil3178,It would be a lot better if the time and score was on the screen like it is when you are watching on TV.,,2 months ago,06/04/2024
@_ABC_123,At least add the clock,1,2 months ago,06/04/2024
@AnhucPhamTien,What an Onana,2,2 months ago,06/04/2024
@GaraadFaaruuq,"Can't they find someone else as a commentator?
Martin slaughtered this match ",1,2 months ago,06/04/2024
@cholasubpinpimansan336,Thank you ,,2 months ago,06/04/2024
@TenToesDownInc.,HISTORY created…. ladies and gentlemen.,1,2 months ago,06/04/2024
@kaydeeduminy4804,Big win for United,,2 months ago,06/04/2024
@Alfa-Gdog,Glory glory Man United!!!,,2 months ago,06/04/2024
@RedDeerBlog,Glory glory Man United ,,2 months ago,06/04/2024
@deliafredericks7578,"Thank you
Thank you",,2 months ago,06/04/2024
@DojoDyo,unreal match will go down in history,,2 months ago,06/04/2024
@ahmadabdullahhasansiddiq3901,Glory glory manchester united,,2 months ago,06/04/2024
@Boss-dn1pq,Wonder why they subed off salah in a big game like this,2,2 weeks ago,06/04/2024
@illupo2001,This is why i love watching football ,,2 months ago,06/04/2024
@adamsad4891,The best football game ever since human invent soccer,1,2 months ago,06/04/2024
@joaobarroso5668,Absolutamente sensacional!,,2 months ago,06/04/2024
@delfordmwale,what a wonderful game,,2 months ago,06/04/2024
@PowlMG,the commentator is so dull,2,2 months ago,06/04/2024
@ericcantona3624,"Мда, эпичная битва вышла. Один из лучших матчей сезона в футболе",1,2 months ago,06/04/2024
@kleinsitwala2357,Thank you!,,2 months ago,06/04/2024
@zahirabbasmogul4660,This one is definitely hitting a million views,,2 months ago,06/04/2024
@larslarsen439,repeat LFG! worth watching again,1,2 months ago,06/04/2024
@wasard8913,UNBELIEVABLE ,,2 months ago,06/04/2024
@ayatullahruhiyat,Just once in one hundred years game like this... 🇲🇨,,2 months ago,06/04/2024
@luuuhh8584,thank you so much Gnarcho,,2 months ago,06/04/2024
@rey_savage,"Bro's Aron's defensive instincts are the best of sny player ive ever seen, no cap. 1:30, watch him clear that ball instead of shooting it",,2 months ago,06/04/2024
@ajuuvex4132,"Thanks you so much, I miss a game  cause our country is on F UP SITUATION & we don't have 24hr
Electricity, So Thank U admin for uploading a Full Match, Really Appritiate it 
 u FA CUP PAGE",,2 months ago,06/04/2024
@SheffieldMagonagona,It was a very entertaining game. what a come back from MU,,2 months ago,06/04/2024
@ThanniTours001,congratulation JEFF,,7 days ago,06/04/2024
@XJokermanX,Wheres the scoreline lol,1,2 months ago,06/04/2024
@jakobjager1734,This is an instant classic ,,2 months ago,06/04/2024
@user-qo5fx9co9y,"Match Classic 
️",,2 months ago,06/04/2024
@lesleysnipe,W admin for uploaded full match,,2 months ago,06/04/2024
@ProDongaDinga,WE WON,2,2 months ago,06/04/2024
@rohitshivadas8774,"9:38 Goal for Manchester United Scott Mctominay
43:43 Goal for Liverpool Alexis Mac Allister
46:54 Goal For Liverpool Mohammad Salah
1:31:24 Goal for Manchester United Antony
 Goal for Liverpool Harvey Elliot
 Goal for Manchester United Marcus Rashford
 : Additional Extra time ( Ended)",1,2 months ago (edited),06/04/2024
@waitindi1451,Best game this season,,2 months ago,06/04/2024
@manu47193,thank you FA cup,,2 months ago,06/04/2024
@oosto89,ดูกี่ครั้งก็ไม่เบื่อ นี่จะเป็นอีกหนึ่งเกมที่จะอยู่ในประวัติศาสตร์ ทีมรองบ่อนใครมองก็ว่าสู้ไม่ได้ แต่กลับทำได้ ด้วยแผนแปลกๆของ เทน ฮาก,,2 months ago,06/04/2024
@zacksnow1979,"Just watched full match again and no doubt in my mind that Tyler is a Liverpool and to think those always the victims tried to pretend he was anti lfc I absolutely despise that club, get in you'll never get a better chance of winning the treble",1,2 months ago,06/04/2024
@huyviet3183,Mỗi trận đấu đều có những người hùng  đóng góp trực tiếp vào chiến thắng của toàn đội,,2 months ago,06/04/2024
@mr.samuelaidoo,"Imagine if United had lost this game. Ten Hag would have been called clueless for putting the player(Antony) who got the equalizer at LB. 
The fine margins ",,2 months ago,06/04/2024
@leniceang,Classic match ,,2 months ago,06/04/2024
@ErnsDaBurns,Twas a pleasure my guys,,2 months ago,06/04/2024
@karimbenzema99999,2:13:19,2,2 months ago (edited),06/04/2024
@SteveroyWilliams,"Who watched backgardenyans
27:03",1,2 days ago,06/04/2024
@carolinebahati4036,Man u for life,1,2 months ago,06/04/2024
@ChristineMihindo,Walar well trained love you,,2 months ago,06/04/2024
@sq2548,nah i’m not happy w the commentary for amads goal especially… it was dead ,1,2 months ago,06/04/2024
@mr.samuelaidoo,"McTominay was injured, Bruno was injured, Antony was at LB, maguire was a SS, Erikson and Bruno were CB’s, Amad scored the last goal 
 The beauty in the  chaos
You can’t tell me this team aren’t playing for the manager and the badge.",,2 months ago,06/04/2024
@Lucky-to7ly,You would expect the final goal to have some thrilling commentary but mr Tyler what was that ,,2 months ago,06/04/2024
@Space_boy85,Best game so far of the season,,2 months ago (edited),06/04/2024
@nathanlagat792,Thanks for this video.i wish premier league could do the same,,2 months ago,06/04/2024
@lit_fit9590,That commentary was dead.. Man didn't want to be there,1,2 months ago,06/04/2024
@rollrandy429,To me in the future: Welcome back!,1,2 months ago,06/04/2024
@Jkl1234ggs,I love how the commentator said it’s impossible for a winning goal,,2 months ago,06/04/2024
@user-in7wo1fu2c,All time best match!,,2 months ago,06/04/2024
@jonathasouza6202,Uns dos melhores jogos de mundo.,,2 months ago,06/04/2024
@dineshbalakumar3563,"Bruh was so happy that he uploaded the full game for the neutrals and united fans to watch
 I see what you did there @emiratescup",,2 months ago,06/04/2024
@sumantchambial1539,"That Onana smile in the end 
️",,2 months ago,06/04/2024
@chriswhamilton,That commentary is shocking,1,2 months ago,06/04/2024
@witekrudawski4310,That's so sad that Liverpool lost ,1,2 months ago,06/04/2024
@itsmanunair,Wow wow wow the whole match. Can some one list all the moments mainoo impressed,,2 months ago,06/04/2024
@ttatir,excelente,1,2 months ago,06/04/2024
@nasgor9388,on what minute is legendary defense 79 minute ?,,2 months ago,06/04/2024
@Rhoetex, Thank you so much for this ,,2 months ago,06/04/2024
@troy8063,1:22:08 this kid man...hes gonna be something special ,,2 months ago,06/04/2024
@Rmorgan_121,greatest game in a while,,2 months ago,06/04/2024
@sunilphadera4176,What a last goal ,,2 months ago,06/04/2024
@jamescoetzee-suddaby3409,Mainoo 1 minute in leaves 3 Liverpool players for dead. Quality player.,,2 months ago,06/04/2024
@user-jq7gz6cy5p,เยี่ยมมาก,,2 months ago,06/04/2024
@TD_pb,I saw a lot of patterns in this game. ETH needs better players especially on defense and midfield and he ll have them playing really well.,,2 months ago,06/04/2024
@khoirulagguero1946,Amad Diallo's first yellow card in my opinion wasn't very fair... he just wanted to put the ball in the right position,,2 months ago,06/04/2024
@user-qt3lc6nx9n,Wow goal goal,,2 months ago,06/04/2024
@nethmedi,all eras come to an end,1,2 months ago,06/04/2024
@ailamax4077,I just love it pain went straight to Stamford bridge,,2 months ago,06/04/2024
@ntambiroger3497,The match of the 20th century ,,2 months ago,06/04/2024
@ronny101,great game. ,,2 months ago,06/04/2024
@caocaohehe,What a match,,2 months ago,06/04/2024
@mihalishat,Noting the score somewhere on screen would be nice,,2 months ago,06/04/2024
@quinnysworld1086,This account has never seen the kind of engagement they've seen since this game,,2 months ago,06/04/2024
@HarmanSingh-nr5mv,Imagine posting a match without timer,1,2 months ago,06/04/2024
@Red_Devil_AOJ,How did we go from this performance to THAT performance against Brentford in the league?,,2 months ago,06/04/2024
@adityarahman7239,Best FA Cup Match in the history,,2 months ago,06/04/2024
@hbgydhnv,best feeling when is was in school as a red ,1,2 months ago,06/04/2024
@sanchomufc8005,What a game,,2 months ago,06/04/2024
@fightfan9739,"Ref wanted Klopp to win, shambles",1,2 months ago,06/04/2024
@shakunkothari2272,"United did fine in the first half, Liverpool dominated the 2nd half for 40 mins, united were attacked more in extra time with liverpool having some chances, in the end it was about which team took their chances better.",,2 months ago,06/04/2024
@vietchinhnguyen6358,1:23:38 5 beat 2 but Liver still couldn't score ,1,2 months ago,06/04/2024
@truonggiangle5817,Thanks you verrrrrrrry muchhhhhhhhh,,2 months ago,06/04/2024
@seizeverything,"So much of biased commentary, glad United won could see pain their voices",2,2 months ago (edited),06/04/2024
@sirbenedict2519,"Riveting commentary, especially at the end. Wow",1,2 months ago,06/04/2024
@user-oe2qe6pg9k,"Man , this one is to be noted in the book of history",,2 months ago,06/04/2024
@stiwjoox2,its rarely to see a full match uploaded on youtube. i wish EPL would do the same.,,2 months ago,06/04/2024
@vahieuthau6763,The reason is called the king spost and I love football,,2 months ago,06/04/2024
@augustinavictor4861,Live match is always the best,,2 months ago,06/04/2024
@eoinryan-kp6sd,I think Anthony has proven he’s a big game player,,1 month ago,06/04/2024
@london977,"This was the turn down for Liverpool, they couldn't recover from it.",,3 weeks ago,06/04/2024
@troy8063,1:08 thats why he will be the next seedorf ,,2 months ago,06/04/2024
@HS-vl7gn,Mainoo phenomenal player,,2 months ago,06/04/2024
@riantono317,We are united ,,2 months ago,06/04/2024
@dangmattien,time ?,1,2 months ago,06/04/2024
@Obetv01,"Just try and follow the fortunes of Bruno Fernandes on this pitch, in this game. Pay attention to his pressing.",,2 months ago,06/04/2024
@12point131,Full Match?!? Well Played “Fa Cup Channel”!,,2 months ago,06/04/2024
@Saipanefha004,Man Unt,1,2 months ago,06/04/2024
@aaronbibby7210,edging all the way to amads winner like a true united fan,,2 months ago,06/04/2024
@mohamedadhnan4724,1:29:56 game started ,1,2 months ago,06/04/2024
@WATM-uq4te,The end of this video is big big smile from onanananna ,,2 months ago,06/04/2024
@Yola101,this game was personal fr,,2 months ago,06/04/2024
@user-pj1sw7ir6r,The best.,,2 months ago,06/04/2024
@hidayatulhaq8973,,,2 months ago,06/04/2024
@peterlfc1387,Why is that arl twt Martin Tyler still commenting?,1,2 months ago,06/04/2024
@AkashMishra-iu4uj,"9:20 Man U 1-0
43:25 Liverpool 1-1
46:43 Liverpool 1-2
1:31:06 Man U 2-2
 Liverpool 2-3
 Man U 3-3
 Man U 4-3
Glory Glory Man United ",,2 months ago,06/04/2024
@kenankit,Liverpool fans kindly take the L and stop pestering  UTD fans,1,2 months ago,06/04/2024
@masbassiruka540,Mantap bosku,1,2 months ago,06/04/2024
@Squeenix1,the commentary is too static. hes a legend for sure but man its time to get new blood in,,2 months ago,06/04/2024
@eatorama,"gila garnacho main 2 jam masih bisa sprint dimenit akhir.
dan ndak ada yang kram",,2 months ago,06/04/2024
@bryngefferies7530,"At present The Old Trafford Stadium is still incomplete & needs is an upgrade of the SBC stand & East & West quadrant to be completed first before you can sort out the roof. 

This Stadium has a lot of potential & can be one of the best stadium in Europe if not the world with the original design cos it has character & authentic with the potential capacity of at least 90K, all it needs is an refurbished & some TLC. 

Take Note: The Stadium Expansion Must Not Exceed the rail way track! 

Man Utd 's Old Trafford 'The Super Bowl of Stadiums known as 'The Theatre of Dreams' is unique & a Colossal of a stadium.",1,2 months ago,06/04/2024
@danangadiw.6035,,1,2 months ago,06/04/2024
@JeremiahAwe,What a legend. Don’t give me height advantage cause I’ll still hit the frog splash till this day!,,2 months ago,06/04/2024
@garethdeere4822,Always enjoy when klopps fake smile breakers.,,2 months ago,06/04/2024
@smagdessian,I. Was. There. Best day of my life,,2 months ago,06/04/2024
@komradenoah8245,2:10:05 Fernandes playing as CB making a tackle while injured,,2 months ago,06/04/2024
@marcus8030,Timer ?,,2 months ago,06/04/2024
@KISWANTO_SP,The best match so far 2024,,2 months ago,06/04/2024
@patlormreacts494,The World Cup final of the FA cup,,2 months ago,06/04/2024
@PenelopeRami2023,lets go man united!,,1 month ago,06/04/2024
@dk7mkd74,Classic!!,1,2 months ago,06/04/2024
@richdoct3079,Gokilll full match,,2 months ago,06/04/2024
@Krmpls,Which one is the green one?,,2 months ago,06/04/2024
@user-se1ul6di6z,Bravo MU,,2 months ago,06/04/2024
@kylelacey8036,Man utd deserves to go through,1,2 months ago,06/04/2024
@roskylolipop8204,12:01 its Robertson handball went unpunished,,2 months ago,06/04/2024
@14llison,Amad gave his jersey to the guy in the stands 🥹,,2 months ago (edited),06/04/2024
@Zaid-ju6ps,Wow man united,,2 months ago,06/04/2024
@SarahWinterbottom-dv3tm,"My grandparents were from Liverpool so i guess that's my team too now,",,2 months ago,06/04/2024
@llamus8432,why isnt there a scorecard?,,2 months ago,06/04/2024
@GreasyBelcher,"These commentators going on about Salah not defending, or “Rather not defending”… Don’t watch Liverpool often. The guy is a workhorse and does as much defending as anyone, especially when Trent is all over the place.",,2 months ago,06/04/2024
@AhsaniTakwim,0:14 yes it is mate another thrilling match happened,,2 months ago (edited),06/04/2024
@katanalugo9912,If we hadn’t won this game I would have blamed Rashford for Liverpool equalising goal plus his missed chances..,,2 months ago,06/04/2024
@user-ul5yt7cd9o,"Фанаты МЮ радуются так, как будто чемпионство или Лигу Чемпионов выиграли!! Им напомнить, как они не настраивались на предыдущие матчи с Ливерпулем и влетали 4-0 , 5-0,7-0. Через 8 лет вырастет целое поколение фанатов Юнайтед, которое не знает чемпионств.",,4 weeks ago,06/04/2024
@peacefarms5871,"Liverpool loves to play with fire 
 ",,2 months ago,06/04/2024
@Zapala10,"Only boring part of the game was Martin Tyler, really didn’t fuss over some of the goals",,2 months ago,06/04/2024
@syaifulrizal8228,"Jarang jarang sampai di tayangkan ulang full begini
Kalo bukan el clasico nya inggris",,2 months ago,06/04/2024
@ekkapannaimpradit3668,2:11:25 This is the best of the F.A.Cup.,,2 months ago,06/04/2024
@ymeyradenme7060,,,2 months ago,06/04/2024
@workmail725,"Martin Tyler ""liverpool paying the price for missing chances""  yet United had more and better chances in the game.",2,2 months ago,06/04/2024
@user-rn7vm6qx3c,Man united supremat.,1,2 months ago,06/04/2024
@user-lo1kg4jb5h,,,2 months ago,06/04/2024
@raydengasak,MU keep THIS performance can beat any team,,2 months ago,06/04/2024
@ytadmin204,,,2 months ago,06/04/2024
@user-iu6ge7sm6h,,1,2 months ago,06/04/2024
@richyorosun9187,that match was everything. But the commentator was an obvious liverpool fan. How lack lustre. It was like it always happens!,,2 months ago,06/04/2024
@odawgbrazy14,"A ROUND OF SCOUSER TEARS ON ME LADS!!!!! 


Wembley Wembley 
Here we come",,2 months ago,06/04/2024
@anne-mariecallanan4290,Tomorrow will be classic united have to win this for ten hag ,,1 month ago,06/04/2024
@michaelprokes3038,change Bruno for Harry was amazing gamechange,1,2 months ago,06/04/2024
@dominicpayne4393,I just re-watched the game via this channel and the commentary is awfully biased. Lots of little undertones it’s sad really.,1,2 months ago,06/04/2024
@Andryk.,Посмотррю еще раз как выигрывает Манчестер Юнайтед ,,2 months ago,06/04/2024
@keithwilliams2218,Very poor commentary.,2,2 months ago,06/04/2024
@user-er5cc7nu3l,"Yang hilang dari united adalah sebuah serangan menusuk layaknya CR7, giggs, nani, young, dan banyak lagi. Dan kini Garnacho melakukan nya lagi apa yang hilang dari united untuk menyerang berani seperti seorang Prabowo Subianto. Hidup Indonesia Maju Prabowo Presiden RI 2024-2029 ",1,2 months ago,06/04/2024
@lawrenceip3418,I’m from Hongkong. Is it due to license issue so that I can’t watch it?,,2 months ago,06/04/2024
@swayze3602,"Guys how can i get into football even if i dont know the logistics of it like positions and stuff i know the basics ive played alot in school and really enjoyed it but im 22 now and thinking of playing seriously + im really competitive too lol and haven't felt passionate about anything else any advice would be appreciated. From Australia 
️",,3 weeks ago (edited),06/04/2024
@oakandiron_,Seriously… thank you Emirates for posting this in its entirety!!! ,,2 months ago,06/04/2024
@xdMistrSeed,"Adhd and Ptsd all at the same time 
 lovely",,2 months ago,06/04/2024
@hisguiltycrown,To my children watching this in the future: yes… it WAS this great 🥹,,2 months ago,06/04/2024
@Ali555aliasdy,مباراة رائعة بين زعيم أنكلترا مانجستريونايتد ومنافسه التقليدي ليفربول,,2 months ago,06/04/2024
@hemmm7205,mainoo what a gem,,2 months ago,06/04/2024
@kieranwylie7893,"Watching this after knowing the result is a completely difference 
UNITED",,2 months ago,06/04/2024
@Milliethepuppy,Most enthusiastic contator ive ever see. ,,2 months ago,06/04/2024
@ryonchandra9140,like this game,,2 months ago,06/04/2024
@uptowngui,"we're the famous man united and we're going to wemberley 
️",,2 months ago,06/04/2024
@leefox9142,Second goal was offside before the build up for Antony’s goal why wasn’t the linesman flag not up I definitely thought it was offside but I didn’t hear anything back from commentary or var what do you think ,,2 months ago,06/04/2024
@BAC_Clips,Whys it gonna premiere,1,2 months ago,06/04/2024
@shawncdonnelly,An instant classic.,,2 months ago,06/04/2024
@Jamie-kv1uv,What happened to Martin Tyler? Once upon a time there would have been epic commentary for a last min winner between these 2 great clubs. Stop giving him airtime. He's given up on the game so give up on him,,2 months ago,06/04/2024
@Gowthamudupi,we are UNITED,,2 months ago,06/04/2024
@chileshemwewa8873,Scoreboard would be nice but thanks,,2 months ago,06/04/2024
@nickchapman145,putting martin tyler on commentary was such a huge mistake,,1 month ago,06/04/2024
@qqwayne7779,"Best Full match, but did'nt have  scoreboard..",,2 months ago,06/04/2024
@Rimas_loves,Live love liverpool,,3 weeks ago,06/04/2024
@multimediafan6777,00:11:45 That tackle from Robertson,,2 months ago,06/04/2024
@ngetaleonard9664,Where's is Peter drury,1,2 months ago,06/04/2024
@kokkiat,Admin must be a United fan too,,2 months ago,06/04/2024
@lsari6948,Szoboszlai a legjobb játékos.,,1 month ago,06/04/2024
@KhoiNguyen-oc1kz,Why the commentary sounds so boring? it feels like like commentators are really sleepy. Are they Liverpool fans?,,2 months ago,06/04/2024
@pujanviramgama9031,Why don't they display the scoresheet in the corner ever man.. annoying,,2 months ago,06/04/2024
@valerienaidoo3853,"Martin Tyler is far better than some of the premier league deadbeats....i turn sound down because they are boring, predictable and biased against united....some were the most ordinary players commenting about the biggest club",1,2 months ago,06/04/2024
@ProDongaDinga,LETS GII,,2 months ago,06/04/2024
@HassaanAlijuttBRAND-yg5gd,I love cricket very much ,1,3 weeks ago,06/04/2024
@gentlegab,but the FA dont usually upload FULL Time games for FA Cup.. or is it because it is a classsic Man U vs Liverpool game ?,,2 months ago,06/04/2024
@kylebriffa7,Never underestimate United,,2 months ago,06/04/2024
@ramseythailand4469,Mainoo & Amad You Know Liverpool,,2 months ago,06/04/2024
@10-D-Kai,Amad Dialooo,,2 months ago,06/04/2024
@DinoRenald,Why would you not show the score line though?,,2 months ago,06/04/2024
@moodyhmoody6608,"Can anyone in this world explain why there’s no scoreboard or timer, couldn’t know which half and what was the score",,13 days ago,06/04/2024
@AriJ87,"Amazing game, but still doesn’t beat United vs Arsenal 1999 semi-final, Villa Park.",,2 months ago,06/04/2024
@sultanazam384,,1,2 months ago,06/04/2024
@melishek0001,ESPN and their grudging comments.,,2 months ago,06/04/2024
@ChristineMihindo,Well trained play the ball,,2 months ago,06/04/2024
@jackmorrison8059,amazing game. announcers so lame. kept saying that United are onto the quarterfinals…,,2 months ago,06/04/2024
@allayx.6974,Commentator ZERO enthusiasm,2,2 months ago,06/04/2024
@ishowspeed3278,nice,1,2 months ago,06/04/2024
@hamidb75,"What a game, I think Quansah should've been midfielder better than center-back, Nunez and Diaz should've been gone out on first half, and Gakpo was in the cloud, this was a catastrophe.",,2 months ago (edited),06/04/2024
@HappyCodingZX,The Ten Hag Tykes!,,2 months ago,06/04/2024
@wesleyodac,"This is United vs City all over again with Nani scoring the winner last minute. United are having a bad season due to injuries but in the end we entertained the neutral in most games. Just look at the CL, after we got knocked out it became a snooze fest",,2 months ago,06/04/2024
@user-qq1qq5nh6f,See martin was overjoyed at amads winner ,,2 months ago,06/04/2024
@vedram7367,I heard some people say Antony didn't have a right foot....,,2 months ago,06/04/2024
@ramadimetsamachete5705,Klopp is humbled!!!,,2 months ago,06/04/2024
@user-to3rf9fh5l,GGMU,1,2 months ago,06/04/2024
@user-vt9pd8hn2u,great,,2 months ago,06/04/2024
@XJokermanX,Holy w,,2 months ago,06/04/2024
@argiggs1794,,,2 months ago,06/04/2024
@nadthapongocharoenkul7634,Second half?,,2 months ago,06/04/2024
@bambangls2066,The best,,2 months ago,06/04/2024
@Md_Asad_267,,,2 months ago,06/04/2024
@Kibrani,"Come on You United 
️🫡",,2 months ago,06/04/2024
@BhurtunAvrish,Just google the match guys it was yesterday,,2 months ago,06/04/2024
@alexranzy,Mu ,1,2 months ago,06/04/2024
@Tom-jg2ss,Why hasn't Tyler (the commentator) retired yet? Know when to leave the stage with grace man,1,2 months ago,06/04/2024
@radendanellayasmineprittas9846,unreal,,2 months ago,06/04/2024
@joaoantonio8600,Klopp is the right man to ask!,,3 weeks ago,06/04/2024
